{
  "id": "disease:down-syndrome",
  "type": "disease",
  "title": "Down Syndrome (Trisomy 21)",
  "slug": "down-syndrome",
  "aliases": [
    "trisomy 21"
  ],
  "tags": [
    "chapter-09",
    "aneuploidy"
  ],
  "status": "active",
  "wiki_path": "wiki/diseases/down-syndrome.md",
  "summary": "A chromosomal disorder caused by three copies of chromosome 21 (trisomy 21) instead of the usual two. The extra chromosome arises from processes/nondisjunction during meiosis (most often in the egg). Affects ~1 in 700 births.",
  "source_refs": [],
  "confidence": 1.0,
  "provenance": {
    "ingested_from": [
      "wiki/diseases/down-syndrome.md"
    ],
    "method": "parser",
    "extractor_version": "0.1.0"
  },
  "version": 1,
  "created": "2026-04-29",
  "updated": "2026-04-29",
  "chapters": [
    9
  ],
  "exam_topics": [
    "nondisjunction"
  ]
}
