{
  "id": "exam_topic:crossing-over",
  "type": "exam_topic",
  "title": "What is crossing over and when does it occur? What's the point?",
  "slug": "crossing-over",
  "aliases": [],
  "tags": [
    "exam-3",
    "chapter-09",
    "recombination"
  ],
  "status": "active",
  "wiki_path": "wiki/exam-topics/crossing-over.md",
  "summary": "",
  "source_refs": [],
  "confidence": 1.0,
  "provenance": {
    "ingested_from": [
      "wiki/exam-topics/crossing-over.md"
    ],
    "method": "parser",
    "extractor_version": "0.1.0"
  },
  "version": 1,
  "created": "2026-04-29",
  "updated": "2026-04-29",
  "chapters": [
    9
  ]
}
