{
  "id": "exam_topic:sex-linked-punnett",
  "type": "exam_topic",
  "title": "Punnett squares for sex-linked alleles — diseased female × normal male",
  "slug": "sex-linked-punnett",
  "aliases": [],
  "tags": [
    "exam-3",
    "chapter-10",
    "sex-linked"
  ],
  "status": "active",
  "wiki_path": "wiki/exam-topics/sex-linked-punnett.md",
  "summary": "",
  "source_refs": [],
  "confidence": 1.0,
  "provenance": {
    "ingested_from": [
      "wiki/exam-topics/sex-linked-punnett.md"
    ],
    "method": "parser",
    "extractor_version": "0.1.0"
  },
  "version": 1,
  "created": "2026-04-29",
  "updated": "2026-04-29",
  "chapters": [
    10
  ]
}
