{
  "id": "exam_topic:pre-mrna",
  "type": "exam_topic",
  "title": "Pre-mRNA — cap, tail, and longer than needed",
  "slug": "pre-mrna",
  "aliases": [],
  "tags": [
    "exam-3",
    "chapter-12"
  ],
  "status": "active",
  "wiki_path": "wiki/exam-topics/pre-mrna.md",
  "summary": "",
  "source_refs": [],
  "confidence": 1.0,
  "provenance": {
    "ingested_from": [
      "wiki/exam-topics/pre-mrna.md"
    ],
    "method": "parser",
    "extractor_version": "0.1.0"
  },
  "version": 1,
  "created": "2026-04-29",
  "updated": "2026-04-29",
  "chapters": [
    12
  ]
}
