{
  "id": "concept:dizygotic-twins",
  "type": "concept",
  "title": "Dizygotic (Fraternal) Twins",
  "slug": "dizygotic-twins",
  "aliases": [],
  "tags": [
    "chapter-09"
  ],
  "status": "active",
  "wiki_path": "wiki/concepts/dizygotic-twins.md",
  "summary": "Fraternal twins — two separate sperm fertilize two separate egg cells in the same cycle. Genetically, dizygotic twins are no more similar than ordinary siblings (~50% shared DNA). They can be different sexes and look very different.",
  "source_refs": [],
  "confidence": 1.0,
  "provenance": {
    "ingested_from": [
      "wiki/concepts/dizygotic-twins.md"
    ],
    "method": "parser",
    "extractor_version": "0.1.0"
  },
  "version": 1,
  "created": "2026-04-29",
  "updated": "2026-04-29",
  "chapters": [
    9
  ]
}
