{
  "id": "disease:albinism",
  "type": "disease",
  "title": "Albinism",
  "slug": "albinism",
  "aliases": [],
  "tags": [
    "chapter-10",
    "autosomal-recessive"
  ],
  "status": "active",
  "wiki_path": "wiki/diseases/albinism.md",
  "summary": "An autosomal-recessive disorder characterized by lack of melanin pigment in skin, hair, and eyes. Caused by mutations in genes (typically TYR — tyrosinase) that produce or transport melanin. Listed in the chapter as an example of a recessive trait.",
  "source_refs": [],
  "confidence": 1.0,
  "provenance": {
    "ingested_from": [
      "wiki/diseases/albinism.md"
    ],
    "method": "parser",
    "extractor_version": "0.1.0"
  },
  "version": 1,
  "created": "2026-04-29",
  "updated": "2026-04-29",
  "chapters": [
    10
  ]
}
