{
  "id": "exam_topic:crossing-over-and-linkage",
  "type": "exam_topic",
  "title": "How does crossing over create new patterns of gene linkage?",
  "slug": "crossing-over-and-linkage",
  "aliases": [],
  "tags": [
    "exam-3",
    "chapter-10",
    "recombination"
  ],
  "status": "active",
  "wiki_path": "wiki/exam-topics/crossing-over-and-linkage.md",
  "summary": "",
  "source_refs": [],
  "confidence": 1.0,
  "provenance": {
    "ingested_from": [
      "wiki/exam-topics/crossing-over-and-linkage.md"
    ],
    "method": "parser",
    "extractor_version": "0.1.0"
  },
  "version": 1,
  "created": "2026-04-29",
  "updated": "2026-04-29",
  "chapters": [
    10
  ]
}
