{
  "id": "term:f2-generation",
  "type": "term",
  "title": "F2 Generation",
  "slug": "f2-generation",
  "aliases": [
    "second filial"
  ],
  "tags": [
    "chapter-10",
    "mendel"
  ],
  "status": "active",
  "wiki_path": "wiki/terms/f2-generation.md",
  "summary": "The second filial generation — produced by self-pollinating F1 individuals (Yy × Yy). The F2 shows the classic 3:1 phenotypic ratio (dominant : recessive) and 1:2:1 genotype ratio (YY : Yy : yy). The reappearance of the recessive trait in F2 was Mendel's key clue that traits are inherited as discrete units (alleles), not blended.",
  "source_refs": [],
  "confidence": 1.0,
  "provenance": {
    "ingested_from": [
      "wiki/terms/f2-generation.md"
    ],
    "method": "parser",
    "extractor_version": "0.1.0"
  },
  "version": 1,
  "created": "2026-04-29",
  "updated": "2026-04-29",
  "chapters": [
    10
  ],
  "exam_topics": [
    "p-f1-f2-relationship"
  ]
}
