{
  "id": "exam_topic:telomere-aging",
  "type": "exam_topic",
  "title": "What happens to telomere length as we age?",
  "slug": "telomere-aging",
  "aliases": [],
  "tags": [
    "exam-3",
    "chapter-11",
    "aging"
  ],
  "status": "active",
  "wiki_path": "wiki/exam-topics/telomere-aging.md",
  "summary": "",
  "source_refs": [],
  "confidence": 1.0,
  "provenance": {
    "ingested_from": [
      "wiki/exam-topics/telomere-aging.md"
    ],
    "method": "parser",
    "extractor_version": "0.1.0"
  },
  "version": 1,
  "created": "2026-04-29",
  "updated": "2026-04-29",
  "chapters": [
    11
  ]
}
