{
  "id": "process:rna-processing",
  "type": "process",
  "title": "RNA Processing",
  "slug": "rna-processing",
  "aliases": [],
  "tags": [
    "chapter-12",
    "mrna"
  ],
  "status": "active",
  "wiki_path": "wiki/processes/rna-processing.md",
  "summary": "In eukaryotes, the initial transcript (concepts/pre-mrna|pre-mRNA) is processed in the nucleus before becoming mature mRNA. Three modifications:",
  "source_refs": [],
  "confidence": 1.0,
  "provenance": {
    "ingested_from": [
      "wiki/processes/rna-processing.md"
    ],
    "method": "parser",
    "extractor_version": "0.1.0"
  },
  "version": 1,
  "created": "2026-04-29",
  "updated": "2026-04-29",
  "chapters": [
    12
  ],
  "exam_topics": [
    "pre-mrna",
    "transcription-termination"
  ]
}
