{
  "id": "exam_topic:rounds-of-replication-in-meiosis",
  "type": "exam_topic",
  "title": "How many rounds of DNA replication occur in meiosis?",
  "slug": "rounds-of-replication-in-meiosis",
  "aliases": [],
  "tags": [
    "exam-3",
    "chapter-09"
  ],
  "status": "active",
  "wiki_path": "wiki/exam-topics/rounds-of-replication-in-meiosis.md",
  "summary": "",
  "source_refs": [],
  "confidence": 1.0,
  "provenance": {
    "ingested_from": [
      "wiki/exam-topics/rounds-of-replication-in-meiosis.md"
    ],
    "method": "parser",
    "extractor_version": "0.1.0"
  },
  "version": 1,
  "created": "2026-04-29",
  "updated": "2026-04-29",
  "chapters": [
    9
  ]
}
